<?xml version="1.0" encoding="UTF-8"?>
<institution_usages xmlns:xsi="http://www.w3.org/2001/XMLSchema-instance"
	xsi:noNamespaceSchemaLocation="institution_usage.xsd">
	<institution_usage inst_realm="inst_realm0">
		<usage date="2006-05-03"> </usage>
		<usage date="2006-05-04">
			<local_sn>2147483647</local_sn>
			<national_sn>2147483647</national_sn>
		</usage>
		<usage date="2006-05-05">
			<local_sn>2147483647</local_sn>
			<national_sn>2147483647</national_sn>
			<international_sn>2147483647</international_sn>
		</usage>
	</institution_usage>
	<institution_usage inst_realm="inst_realm1">
		<usage date="2006-05-04">
			<local_sn>2147483647</local_sn>
			<national_sn>2147483647</national_sn>
			<international_sn>2147483647</international_sn>
		</usage>
	</institution_usage>
	<institution_usage inst_realm="inst_realm2">
		<usage date="2006-05-04">
			<international_sn>2147483647</international_sn>
		</usage>
		<usage date="2006-05-04">
			<local_sn>2147483647</local_sn>
			<national_sn>2147483647</national_sn>
			<international_sn>2147483647</international_sn>
		</usage>
		<usage date="2006-05-04">
			<local_sn>2147483647</local_sn>
			<national_sn>2147483647</national_sn>
			<international_sn>2147483647</international_sn>
		</usage>
	</institution_usage>
</institution_usages>
